movie_id,title,main_link,img_link,img_path,pub_year,user_rating,summary,nation,genre,E,I,S,N,F,T,P,J
156464,보헤미안 랩소디,https://movie.naver.com/movie/bi/mi/basic.nhn?code=156464,https://movie.naver.com/movie/bi/mi/photoViewPopup.nhn?movieCode=156464,./img/156464.jpg,2018.0,9.42,공항에서 수하물 노동자로 일하며 음악의 꿈을 키우던 이민자 출신의 아웃사이더 파록버사라보컬을 구하던 로컬 밴드에 들어가게 되면서 프레디 머큐리라는 이름으로 밴드 퀸을 이끌게 된다. 시대를 앞서가는 독창적인 음악과 화려한 퍼포먼스로 관중들을 사로잡으며 성장하던 퀸은 라디오와 방송에서 외면을 받을 것이라는 음반사의 반대에도 불구하고 무려 6분 동안 이어지는 실험적인 곡 보헤미안 랩소디로 대성공을 거두며 월드스타 반열에 오른다.그러나 독보적인 존재감을 뿜어내던 프레디 머큐리는 솔로 데뷔라는 유혹에 흔들리게 되고결국 오랜 시간 함께 해왔던 멤버들과 결별을 선언하게 되는데세상에서 소외된 아웃사이더에서 전설의 록밴드 퀸이 되기까지우리가 몰랐던 그들의 진짜 이야기가 시작된다,"미국,영국",드라마,-0.011583677744865416,0.1707646425485611,0.13348414220809937,0.1052829104423523,0.05740292551120122,0.04972082884609699,0.010911404410998027,0.024084459880987803
203288,잭 스나이더의 저스티스 리그,https://movie.naver.com/movie/bi/mi/basic.nhn?code=203288,https://movie.naver.com/movie/bi/mi/photoViewPopup.nhn?movieCode=203288,./img/203288.jpg,,9.41,슈퍼맨이 죽고 지구에 어둠의 그림자가 드리운다. 마더박스를 차지하기 위해 빌런 스테픈울프가 파라데몬 군단을 이끌고 지구에 온 것이다.지구를 지키기 위해 목숨을 바친 슈퍼맨의 희생이 헛되지 않도록 하기 위해 브루스 웨인은 다이애나 프린스와 적에 맞서기로 한다. 배트맨과 원더 우먼은 새로이 등장한 위협에 맞서 싸우기 위해 특별한 능력을 가진 메타휴먼 아쿠아맨과 사이보그 플래시를 찾아가 설득하여 힘을 합친다.드디어 한 팀이 된 저스티스 리그. 혹시 스테픈울프와 데사드 그리고 다크사이드를 물리치기에 너무 늦어버린 것이 아닐까,미국,"액션,모험,판타지,SF",0.07622523971796036,0.13213843811750411,0.1548437289237976,0.20934085426330568,-0.008901070237159728,0.10892522051557899,0.2391106578906377,0.08146841688950857
10102,사운드 오브 뮤직,https://movie.naver.com/movie/bi/mi/basic.nhn?code=10102,https://movie.naver.com/movie/bi/mi/photoViewPopup.nhn?movieCode=10102,./img/10102.jpg,2017.0,9.42,음악을 사랑하는 말괄량이 견습 수녀 마리아는 원장 수녀의 권유로 해군 명문 집안 폰 트랩가의 가정교사가 된다. 마리아는 좀처럼 마음의 문을 열지 않는 폰 트랩가의 일곱 아이들에게 노래를 가르치며 점차 교감하게 되고 엄격한 폰 트랩 대령 역시 마음의 문을 열게 된다. 그러던 어느 날 마리아는 자신이 폰 트랩 대령을 사랑하고 있다는 사실을 깨닫게 되고 자신만의 비밀을 간직한 채 아이들의 곁을 떠나 다시 수녀원에 들어가기로 결심하는데,미국,"멜로/로맨스,뮤지컬,드라마",0.04533779018521309,0.2534056361436844,0.1297525829911232,0.08901317892074585,0.05477307917674382,0.01236625337600708,-0.07337638741234938,0.03157575790087382
17159,포레스트 검프,https://movie.naver.com/movie/bi/mi/basic.nhn?code=17159,https://movie.naver.com/movie/bi/mi/photoViewPopup.nhn?movieCode=17159,./img/17159.jpg,2016.0,9.41,불편한 다리 남들보다 조금 떨어지는 지능을 가진 외톨이 소년 포레스트 검프 헌신적이고 강인한 어머니의 보살핌과 콩깍지 첫사랑 소녀 제니와의 만남으로 사회의 편견과 괴롭힘 속에서도 따뜻하고 순수한 마음을 지니고 성장한다.여느 날과 같이 또래들의 괴롭힘을 피해 도망치던 포레스트는 누구보다 빠르게 달릴 수 있는 자신의 재능을 깨닫고 늘 달리는 삶을 살아간다. 포레스트의 재능을 발견한 대학에서 그를 미식축구 선수로 발탁하고 졸업 후에도 뛰어난 신체능력으로 군에 들어가 누구도 예상치 못한 성과를 거둬 무공훈장을 수여받는 등 탄탄한 인생 가도에 오르게 된 포레스트.하지만 영원히 행복할 것만 같았던 시간도 잠시 어머니가 병에 걸려 죽음을 맞이하고 첫사랑 제니 역시 그의 곁을 떠나가며 다시 한번 인생의 전환점을 맞이하게 되는데 과연 포레스트는 진정한 삶의 행복을 발견할 수 있을까진정한 삶의 가치와 의미를 제시하는 감동 바이블올 가을 다시 한번 세상에서 가장 눈부신 달리기가 시작된다 Run Forrest Run,미국,"드라마,코미디",0.24324338355064393,0.2809870358228683,0.22834690132141108,0.19964404282569886,0.20363078943888346,0.20524099977314472,0.20096465877691905,0.1592461055914561
10002,빽 투 더 퓨쳐,https://movie.naver.com/movie/bi/mi/basic.nhn?code=10002,https://movie.naver.com/movie/bi/mi/photoViewPopup.nhn?movieCode=10002,./img/10002.jpg,2015.0,9.42,힐 밸리Hill Valley에 사는 주인공 마티 맥플라이Marty McFly 마이클 J. 폭스 분는 록큰롤 스케이트보드 그리고 자동차를 좋아하는 명랑 쾌할한 고교생으로 아버지 죠지George Douglas McFly 크리스핀 글로버 분와 어머니 로레인Lorraine Baines 리아 톰슨 분 그리고 형과 누나가 있는 가정의 평범한 청소년이다. 평소 친하게 지내던 괴상한 발명가 에메트 브라운 박사Dr. EmmDr. Emmett L. Doc Brown 크리스토퍼 로이드 분가 스포츠카 드로리안DeLorean을 개조해 타임머신을 만들지만 뜻밖의 사고로 브라운 박사가 테러범들에게 총을 맞고 위험해진 마티는 급기야 30년 전으로 간다.극장 간판에는 2류 배우인 로널드 레이건이 보이고 청년인 아버지와 어머니를 보게 된다. 그러나 젊은 아버진 여전히 멍청하고 무엇보다 어머니가 미래의 아들인 마티를 좋아해 야단이다. 마티가 미래로 가는 것을 도와 줄 사람은 30년 전인 젊은 브라운 박사뿐. 댄스 파티가 열리는 날에 아버지와 어머니가 만났던 것을 기억한 마티는 두 사람을 결합시키고자 어머니와 파티장으로 간다. 그런데 심술장이 밥Biff Tannen 토마스 F. 윌슨 분이 나타나 어머니를 겁탈하려 하나 화가 난 아버지가 일격에 때려 눕혀 그때부터 소심했던 아버지의 성격이 바낀다. 무사히 부모님은 만나 마티의 존재는 없었지지 않지만 마티의 미래로의 귀환Back to the future이 어려워지는 사태를 맞는데....,미국,"SF,코미디",0.012093264544010163,0.17705707211494445,0.12533607550859452,0.1255589741230011,-0.0391744232972463,-0.005448639899492264,0.022310328304767608,0.038699399570624037
29217,글래디에이터,https://movie.naver.com/movie/bi/mi/basic.nhn?code=29217,https://movie.naver.com/movie/bi/mi/photoViewPopup.nhn?movieCode=29217,./img/29217.jpg,2000.0,9.4,절정기의 로마제국은 그 영토가 광대하여 아프리카 사막에서 잉글랜드 북쪽까지 걸쳐 있었다. 그 당시 세계는 그 총인구의 1/4이 로마 황제의 지배 하에 있었다. 때는 서기 180년 마르커스 아우렐리우스Marcus Aurelius 황제의 12년에 걸친 게르마니아Germania 정벌이 거의 마무리되던 무렵이었다. 마지막 하나 남은 적의 요새만 함락하면 이제 로마 제국은 평화가 온다. 평화로운 5현제 시대가 막바지에 이른 서기 180년 로마. 어두운 삼림. 수백명의 부대가 숨을 죽이고 서 있다. 마치 폭풍전야와 같이. 장군의 신호가 울리고 거대한 함성소리와 함께 하늘에는 불화살 불타는 점토 항아리가 난무하고 땅위는 수많은 병사들의 피로 물든다. 철인 황제 마르쿠스 아우렐리우스Marcus Aurelius 리차드 해리스 분가 아들처럼 친애하는 장군 막시무스General Maximus 러셀 크로우 분는 다뉴브 강가 전투에서 대승한다. 죽을 날이 머지않은 황제 마르쿠스 아우렐리우스는 막시무스를 총애하여 아들이 아닌 그에게 왕위를 넘겨주기로 한다. 그러나 황제의 아들 코모두스는 이에 질투와 분노를 느껴 급기야 황제를 살해한다. 왕좌를 이어받은 코모두스는 막시무스와 그의 가족을 죽이라고 명령한다. 가족을 모두 잃고 혼자 겨우 살아남게 된 막시무스는 노예로 전락하고 투기장의 검투사로 매일 훈련을 받는다. 그에게 남은 건 오로지 새로 즉위한 황제 코모두스에 대한 복수 뿐. 검투사로서 매 경기마다 승리로 이끌면서 살아남자 그의 명성과 인기는 날로 높아간다. 로마로 돌아온 그는 아내와 아들을 죽인 코모두스에 대한 복수를 다짐한다. 그러던 어느날 오래전 사랑했던 황제의 누이 루실라Lucilla 코니 닐슨 분를 다시 만나게 된다. 어느 새 민중의 영웅이 된 막시무스. 코모두스는 그가 아직 살아있음을 알고 분노하지만 민중이 두려워 그를 죽이지 못한다. 드디어 막시무스는 예전의 부하들과 은밀히 만나 사랑하는 아내와 아들 존경하던 황제를 살해한 난폭한 황제 코모두스에 대한 복수를 결의한다. 아직도 막시무스를 사랑하고 있는 루실라는 동생 코모두스를 배신하고 막시무스의 반란을 도우려 하는데.,"미국,영국","액션,드라마",0.0663002423286438,0.16270313520431517,0.188661809758842,0.1936650770664215,0.04834036461512248,0.10122290109843016,0.23913995854059855,0.11062338813145955
106360,위대한 쇼맨,https://movie.naver.com/movie/bi/mi/basic.nhn?code=106360,https://movie.naver.com/movie/bi/mi/photoViewPopup.nhn?movieCode=106360,./img/106360.jpg,2020.0,9.41,쇼 비즈니스의 창시자이자 꿈의 무대로 전세계를 매료시킨 남자바넘의 이야기에서 영감을 받아 탄생한 오리지널 뮤지컬 영화 위대한 쇼맨.레미제라블 이후 다시 뮤지컬 영화로 돌아온 휴 잭맨부터 잭 에프론 미셸 윌리엄스 레베카 퍼거슨 젠다야까지할리우드 최고의 배우들이 합류해 환상적인 앙상블을 선보인다.여기에 미녀와 야수 제작진과 라라랜드 작사팀의 합류로더욱 풍성해진 비주얼과 스토리 음악까지 선보일 위대한 쇼맨은우리는 누구나 특별하다는 메시지로 관객들에게 재미는 물론 감동까지 선사할 것이다.THIS IS ME 우리는 누구나 특별하다,미국,"드라마,뮤지컬",0.14009397842884064,0.28562068004608154,0.19221163907051086,0.16454237875938416,0.05096374260385831,0.08618161311000586,0.14458211692174275,0.06704793735345205
82432,헬프,https://movie.naver.com/movie/bi/mi/basic.nhn?code=82432,https://movie.naver.com/movie/bi/mi/photoViewPopup.nhn?movieCode=82432,./img/82432.jpg,2011.0,9.42,1963년 미국 남부 미시시피 잭슨흑인 가정부는 백인 주인과 화장실도 같이 쓸 수 없다아무도 가정부의 삶에 대해 묻지 않았다. 그녀가 책을 쓰기 전까지는돈 많은 남자와 결혼해 정원과 가정부가 딸린 집의 안주인이 되는 게 최고의 삶이라 여기는 친구들과 달리 대학 졸업 후 작가의 꿈을 이루기 위해 지역 신문사에 취직한 스키터엠마 스톤. 살림 정보 칼럼의 대필을 맡게 된 그녀는 베테랑 가정부 에이빌린바이올라 데이비스에게 도움을 요청한다. 다른 인생은 꿈꿔보지도 못한 채 가정부가 되어 17명의 백인 아이를 헌신적으로 돌봤지만 정작 자신의 아들은 사고로 잃은 에이빌린. 스키터에게 살림 노하우를 알려주던 그녀는 어느 누구도 관심 갖지 않았던 자신과 흑인 가정부들의 인생을 책으로 써보자는 위험한 제안을 받는다. 때 마침 주인집의 화장실을 썼다는 황당한 이유로 쫓겨난 가정부 미니옥타비아 스펜서가 두 여자의 아슬아슬하지만 유쾌한 반란에 합류한다. 차별과 불만을 이야기 하는 것조차 불법이 되고 생명을 위협받는 일이 되는 시대에 태어나 처음으로 누군가에게 자신들의 이야기를 털어 놓기 시작하는 에이빌린과 미니. 그녀들의 용기 있는 고백은 세상을 발칵 뒤집을 만한 책을 탄생시키는데,미국,드라마,0.20761961855888367,0.28524886031150815,0.18076546111106873,0.16931115565299987,0.12475742332140605,0.19976587729156017,0.1535980992714564,0.12725311382611593
24452,매트릭스,https://movie.naver.com/movie/bi/mi/basic.nhn?code=24452,https://movie.naver.com/movie/bi/mi/photoViewPopup.nhn?movieCode=24452,./img/24452.jpg,2019.0,9.41,인간의 기억마저 AI에 의해 입력되고 삭제 되는 세상.진짜보다 더 진짜 같은 가상 현실 매트릭스그 속에서 진정한 현실을 인식할 수 없게 재배되는 인간들.그 매트릭스를 빠져 나오면서 AI에게 가장 위험한 인물이 된모피어스는 자신과 함께 인류를 구할 마지막 영웅 그를 찾아 헤맨다.마침내 모피어스는 낮에는 평범한 회사원으로 밤에는 해커로 활동하는 청년 네오를 그로 지목하는데꿈에서 깨어난 자들 이제 그들이 만드는 새로운 세상이 열린다,미국,"SF,액션",0.09564393081665039,0.1540000226020813,0.21077361472845074,0.20493113574981692,0.0011764509677886965,0.08014029586315155,0.23467996648947398,0.09115424617131551
197647,가나의 혼인잔치 언약,https://movie.naver.com/movie/bi/mi/basic.nhn?code=197647,https://movie.naver.com/movie/bi/mi/photoViewPopup.nhn?movieCode=197647,./img/197647.jpg,2020.0,9.4,우리는 소망을 잃어버렸다.예수의 언약을 잊어버렸다.하지만 최근 연구를 통해숨겨둔 언약의 비밀이 드러나게 되는데예수는 무엇을 약속하셨는가역사를 통해 드러난 충격적인 비밀이우리의 영성을 두드린다.가장 안전하고 정확하게 언약 속 비밀을 맞이하라,미국,"다큐멘터리,드라마",0.12893103876113893,0.2561575855731964,0.14444999911785125,0.12885616598129274,0.24578986994425456,0.33630649322271344,0.11770850352446238,0.10503279034296671
22126,인생은 아름다워,https://movie.naver.com/movie/bi/mi/basic.nhn?code=22126,https://movie.naver.com/movie/bi/mi/photoViewPopup.nhn?movieCode=22126,./img/22126.jpg,2016.0,9.4,로마에 갓 상경한 시골 총각 귀도는 운명처럼 만난 여인 도라에게 첫눈에 반한다. 넘치는 재치와 유머로 약혼자가 있던 그녀를 사로잡은 귀도는 도라와 단란한 가정을 꾸리며 분신과도 같은 아들 조수아를 얻는다. 조수아의 다섯 살 생일 갑작스레 들이닥친 군인들은 귀도와 조수아를 수용소 행 기차에 실어버리고 소식을 들은 도라 역시 기차에 따라 오른다. 귀도는 아들을 달래기 위해 무자비한 수용소 생활을 단체게임이라 속이고 1000점을 따는 우승자에게는 진짜 탱크가 주어진다고 말한다. 불안한 하루하루가 지나 어느덧 전쟁이 끝났다는 말을 들은 귀도는 마지막으로 조수아를 창고에 숨겨둔 채 아내를 찾아 나서는데전세계를 울린 위대한 사랑 마법처럼 놀라운 이야기가 찾아온다,이탈리아,"드라마,코미디",0.2213072232246399,0.255953880739212,0.17545588829517364,0.13549949107170106,0.17663720679283143,0.15240710178017616,0.07338727694749832,0.1189419116973877
18847,타이타닉,https://movie.naver.com/movie/bi/mi/basic.nhn?code=18847,https://movie.naver.com/movie/bi/mi/photoViewPopup.nhn?movieCode=18847,./img/18847.jpg,2018.0,9.4,우연한 기회로 티켓을 구해 타이타닉호에 올라탄 자유로운 영혼을 가진 화가 잭레오나르도 디카프리오은 막강한 재력의 약혼자와 함께 1등실에 승선한 로즈케이트 윈슬렛에게 한 눈에 반한다. 진실한 사랑을 꿈꾸던 로즈 또한 생애 처음 황홀한 감정에 휩싸이고 둘은 운명 같은 사랑에 빠지는데,미국,"멜로/로맨스,드라마",0.08943555274009704,0.22209924120903013,0.1383460647702217,0.15322371301651,0.07267340950171153,0.05344316312670708,0.05903459521134694,0.1015625483194987
35901,살인의 추억,https://movie.naver.com/movie/bi/mi/basic.nhn?code=35901,https://movie.naver.com/movie/bi/mi/photoViewPopup.nhn?movieCode=35901,./img/35901.jpg,2003.0,9.41,1986년 경기도. 젊은 여인이 무참히 강간 살해당한 시체로 발견된다. 2개월 후 비슷한 수법의 강간살인사건이 연이어 발생하면서 사건은 세간의 주목을 받기 시작하고 일대는 연쇄살인이라는 생소한 범죄의 공포에 휩싸인다. 사건 발생지역에 특별수사본부가 설치되고 수사본부는 구희봉 반장변희봉 분을 필두로 지역토박이 형사 박두만송강호 분과 조용구김뢰하 분 그리고 서울 시경에서 자원해 온 서태윤김상경 분이 배치된다. 육감으로 대표되는 박두만은 동네 양아치들을 족치며 자백을 강요하고 서태윤은 사건 서류를 꼼꼼히 검토하며 사건의 실마리를 찾아가지만 스타일이 다른 두 사람은 처음부터 팽팽한 신경전을 벌인다. 용의자가 검거되고 사건의 끝이 보일 듯 하더니 매스컴이 몰려든 현장 검증에서 용의자가 범행 사실을 부인하면서 현장은 아수라장이 되고 구반장은 파면 당한다. 수사진이 아연실색할 정도로 범인은 자신의 흔적을 남기지 않는다. 살해하거나 결박할 때도 모두 피해자가 착용했거나 사용하는 물품을 이용한다. 심지어 강간사 일 경우 대부분 피살자의 몸에 떨어져 있기 마련인 범인의 음모 조차 단 하나도 발견되지 않는다. 후임으로 신동철 반장송재호 분이 부임하면서 수사는 활기를 띠기 시작한다. 박두만은 현장에 털 한 오라기 남기지 않는다는 점에 착안 근처의 절과 목욕탕을 뒤지며 무모증인 사람을 찾아 나서고 사건 파일을 검토하던 서태윤은 비오는 날 빨간 옷을 입은 여자가 범행대상이라는 공통점을 밝혀낸다. 선제공격에 나선 형사들은 비오는 밤 여경에게 빨간 옷을 입히고 함정 수사를 벌인다. 그러나 다음날 아침 돌아오는 것은 또다른 여인의 끔찍한 사체. 사건은 해결의 실마리를 다시 감추고 냄비처럼 들끊는 언론은 일선 형사들의 무능을 지적하면서 형사들을 더욱 강박증에 몰아넣는데.,한국,"범죄,미스터리,스릴러,코미디,드라마",0.06387830034792423,0.12846296389102935,0.15186467983722687,0.21320207891464235,-0.029943536400794984,0.1314553892761469,0.27650679580370585,0.10169528786341349
32686,센과 치히로의 행방불명,https://movie.naver.com/movie/bi/mi/basic.nhn?code=32686,https://movie.naver.com/movie/bi/mi/photoViewPopup.nhn?movieCode=32686,./img/32686.jpg,2015.0,9.39,금지된 세계의 문이 열렸다 이사 가던 날 수상한 터널을 지나자 인간에게는 금지된 신들의 세계로 오게 된 치히로..신들의 음식을 먹은 치히로의 부모님은 돼지로 변해버린다.  걱정마 내가 꼭 구해줄게겁에 질린 치히로에게 다가온 정체불명의 소년 하쿠.그의 따뜻한 말에 힘을 얻은 치히로는 인간 세계로 돌아가기 위해 사상 초유의 미션을 시작하는데,일본,"애니메이션,판타지,모험,가족",0.09898024716377259,0.2431004997014999,0.1742422214984894,0.1324304717540741,0.08920534880956014,0.03814373766630888,0.03203221839666367,0.061505778272946676
66463,토이 스토리 3,https://movie.naver.com/movie/bi/mi/basic.nhn?code=66463,https://movie.naver.com/movie/bi/mi/photoViewPopup.nhn?movieCode=66463,./img/66463.jpg,2010.0,9.39,모든 장난감들이 겪는 가장 슬픈일은 바로 주인이 성장해 더이상 자신들과 놀아주지 않는 것. 우디와 버즈에게도 그 위기가 찾아온다. 앤디가 대학에 진학 집을 떠나게 된 것.  헤어짐의 불안에 떨던 토이들은 앤디 엄마의 실수로 집을 나오게 된 이들은 우여곡절 끝에 탁아소에 기증되는 신세가 된다  그런데 오마이갓 어린이집 애들 장난이 아니게 난폭하고 험하다. 그리고 상상도 못했던 거대한 음모까지 숨겨져 있는 어린이집 장난감의 세계.  그러다 앤디가 여전히 자신들을 사랑한다는 사실을 알게 된 토이 군단은 앤디 곁으로 돌아가기 위해 생애 가장 큰 모험을 결심한다. 우디를 중심으로 똘똘뭉친 토이들 과연 이들의 위대한 탈출은 성공할 것인가,미국,"애니메이션,모험,코미디,가족,판타지",0.15171142139434815,0.21086537499427793,0.1537107668161392,0.10706326541900635,0.11842973214387893,0.02402110905945301,0.03330113298694293,0.06464365983009339
31162,캐스트 어웨이,https://movie.naver.com/movie/bi/mi/basic.nhn?code=31162,https://movie.naver.com/movie/bi/mi/photoViewPopup.nhn?movieCode=31162,./img/31162.jpg,2001.0,9.39,세상에서 가장 바쁜 사람인양 전세계를 돌아다니며 시간에 얽매여 살아가는 남자 척 놀랜드톰 행크스 분. 페덱스의 직원인 그는 여자친구 캘리 프레어스헬렌 헌트 분와 깊은 사랑을 나누지만 막상 함께 할 시간은 가지지 못한다. 크리스마스 이브 캘리와의 로맨틱한 데이트를 채 끝내지도 못한 그에게 빨리 비행기를 타라는 호출이 울리고 둘은 연말을 기약하고 헤어지게 된다. 캘리가 선물해준 시계를 손에 꼭 쥐고 페덱스 전용 비행기에 올랐는데 착륙하기 직전 사고가 나고 기내는 아수라장이 된다. 그의 몸을 때리는 파도. 눈을 떠보니 완전 별세상이다. 아름다운 해변과 무성한 나무 높은 암벽. 아무도 살지않는 섬에 떨어진 것을 알게된 척은 그곳에서의 생존을 위해 이전의 모든 삶을 버리고 새로운 환경에 적응하며 외롭게 살아간다. 하지만 캘리에 대한 사랑만을 마음 속에 간직한 채 그녀를 만날 수 있다는 희망을 잃지않는다. 4년후. 고립된 섬에서 1500일이나 되는 시간을 사랑으로 이겨낸 척. 어느 날 떠내려온 알미늄판자 하나를 이용해 섬을 빠져나갈 방법을 고안해내고 자신이 갖고있는 모든 물건을 이용하여 뗏목을 만든다. 섬에 표류한지 4년만에 거친 파도를 헤치고 탈출을 감행하는데.,미국,"드라마,모험",0.15981680073738097,0.22883872051239013,0.19669632830619813,0.17741610584259032,0.18432718447844187,0.14730899637192488,0.14980763626098634,0.12883437538146972
92125,헌터 킬러,https://movie.naver.com/movie/bi/mi/basic.nhn?code=92125,https://movie.naver.com/movie/bi/mi/photoViewPopup.nhn?movieCode=92125,./img/92125.jpg,2018.0,9.38,미 국방부는 격침당한 잠수함의 행방을 찾기 위해 헌터 킬러를 극비리에 투입시키고 캡틴 글래스제라드 버틀러는 배후에 숨겨진 음모가 있음을 알게 된다. 한편 지상에서는 VIP가 납치되어 전세계는 초긴장 상태에 놓이게 되는데 일촉즉발 위기상황 VIP를 구출하라 단 한 척의 공격 잠수함 헌터 킬러와 최정예 특수부대 네이비 씰의 숨막히는 육해공 합동 작전이 펼쳐진다,미국,"액션,스릴러",-0.03234354338645935,0.19993577111959457,0.07437224828600883,0.11161242899894715,-0.023674692392349244,0.07880022884905338,0.026831670920054118,0.008576773618658384
34324,집으로...,https://movie.naver.com/movie/bi/mi/basic.nhn?code=34324,https://movie.naver.com/movie/bi/mi/photoViewPopup.nhn?movieCode=34324,./img/34324.jpg,2019.0,9.38,도시에 사는 7살 개구쟁이 상우가 외할머니가 혼자 살고 계신 시골집에 머물게 된다.말도 못하고 글도 못 읽는 외할머니와의 시골살이상우 인생 최초의 시련은 과연 최고의 추억이 될 수 있을까,한국,"드라마,가족",0.037710579419136046,0.24230181236267087,0.06572898843288422,0.03225152072906494,0.10187771817793449,0.020306349225342274,-0.14377269713083904,0.0467645214398702
31796,반지의 제왕 왕의 귀환,https://movie.naver.com/movie/bi/mi/basic.nhn?code=31796,https://movie.naver.com/movie/bi/mi/photoViewPopup.nhn?movieCode=31796,./img/31796.jpg,2021.0,9.38,모든 힘을 지배할 악의 군주 사우론의 절대반지가 깨어나고악의 세력이 세상을 지배해가며 중간계는 대혼란에 처한다. 호빗 프로도와 그의 친구들 엘프 레골라스 인간 전사 아라곤과 보로미르 드워프 김리 그리고 마법사 간달프로 구성된 반지원정대는 평화를 지키기 위해 절대반지를 파괴할 유일한 방법인 반지가 만들어진 모르도르를 향해 목숨을 건 여정을 떠난다.한편 점점 세력을 넓혀온 사우론과의 피할 수 없는 전쟁을 앞둔반지원정대는 드디어 거대한 최후의 전쟁을 시작하는데...,"뉴질랜드,미국","판타지,모험,액션,전쟁",0.0965523786187172,0.10771974135637283,0.1853225953221321,0.19591322121620178,0.025911264687776565,0.08502664273232222,0.1942870659828186,0.08580434187253316
